{
  "$schema": "http://json-schema.org/draft/2020-12/schema",
  "title": "Application Lifecycle Bundle",
  "description": "Normalized package of design, integration, release, and operations artifacts for a single application or feature run.",
  "type": "object",
  "required": [
    "application_id",
    "version",
    "assembled_at",
    "design",
    "integration",
    "release",
    "operations"
  ],
  "properties": {
    "application_id": {
      "type": "string",
      "pattern": "^[a-z0-9][a-z0-9-]{1,63}$",
      "description": "Unique identifier for the application or feature."
    },
    "version": {
      "type": "string",
      "description": "Semantic or monotonic version for this assembled bundle."
    },
    "assembled_at": {
      "type": "string",
      "format": "date-time",
      "description": "Timestamp when the lifecycle bundle was produced."
    },
    "description": {
      "type": "string",
      "description": "Optional human-readable summary for the bundle."
    },
    "links": {
      "type": "array",
      "description": "Optional references to dashboards, documents, or pipelines relevant to the bundle.",
      "items": {
        "type": "string"
      }
    },
    "design": {
      "description": "Design-phase artifact bundle for the application run.",
      "anyOf": [
        { "$ref": "./design.schema.json" },
        { "type": "null" }
      ]
    },
    "integration": {
      "type": "object",
      "description": "Integration phase outputs and audit trail.",
      "required": ["return_envelopes"],
      "properties": {
        "return_envelopes": {
          "type": "array",
          "items": { "$ref": "./ReturnEnvelope.schema.json" },
          "description": "Chronological list of implementor deliveries applied to the codebase."
        },
        "reviews": {
          "type": "array",
          "items": { "$ref": "./review.schema.json" },
          "description": "Reviewer verdicts associated with the return envelopes."
        },
        "handoff_events": {
          "type": "array",
          "items": { "$ref": "./handoff-event.schema.json" },
          "description": "Detailed orchestration handoff events captured during integration."
        }
      },
      "additionalProperties": false
    },
    "release": {
      "type": "object",
      "description": "Release governance metadata for the bundle.",
      "required": ["plan"],
      "properties": {
        "plan": {
          "description": "Release plan approved for deployment.",
          "anyOf": [
            { "$ref": "./ReleasePlan.schema.json" },
            { "type": "null" }
          ]
        },
        "status": {
          "type": "string",
          "enum": ["draft", "approved", "in_progress", "complete", "halted"],
          "description": "Lifecycle state of the release."
        },
        "approved_by": {
          "type": "string",
          "description": "Optional approver or authority for the release."
        }
      },
      "additionalProperties": false
    },
    "operations": {
      "type": "object",
      "description": "Operational artifacts produced while executing the release.",
      "required": ["deployments", "db_changes", "test_reports"],
      "properties": {
        "deployments": {
          "type": "array",
          "items": { "$ref": "./DeployEnvelope.schema.json" },
          "description": "Deploy envelopes produced per environment."
        },
        "db_changes": {
          "type": "array",
          "items": { "$ref": "./DBChangeEnvelope.schema.json" },
          "description": "Database change envelopes tied to the release."
        },
        "test_reports": {
          "type": "array",
          "items": { "$ref": "./TestReport.schema.json" },
          "description": "Verification reports from executed test suites."
        },
        "notes": {
          "type": "string",
          "description": "Operational summary, incidents, or follow-up actions."
        },
        "incidents": {
          "type": "array",
          "items": { "type": "string" },
          "description": "Incident identifiers or links captured during operations."
        }
      },
      "additionalProperties": false
    },
    "attachments": {
      "type": "array",
      "description": "Supporting documents committed alongside the bundle.",
      "items": { "type": "string" }
    }
  },
  "additionalProperties": false
}
